title,company,location,salary,job_type,description,posted_date
TEAM LEADER,BS ENTERPRISES,"Chennai - Ashok Nagar, Anna Nagar, Kodambakkam, Saidapet + 1 more","20,000 - 25,000",Full Time Jobs,"Delivery/Collections - Cash-Collection, Recovery-Collection","03 May 2025, 03:08 PM"
Delivery Boys,Flipkart,"Rajpura - Dashmesh Colony, Ganesh Nagar, Gobind Colony, New SBS Colony","20,000 - 25,000",Full Time Jobs,Delivery/Collections - Courier-Delivery,"03 May 2025, 01:25 PM"
We are seeking a relible and efficient delivery boy to join our team.,NOT MENTIONED,"Bhubaneswar - Birabandha, Dhauli Square, Jatni Road, Nuagan + 1 more","15,000 - 16,000",Full Time Jobs,Delivery/Collections,"02 May 2025, 12:28 PM"
FIELD EXECTIVE,BS ENTERPRISES,"Chennai - Thiruvallur, Tambaram, Washermanpet, Ambattur + 1 more","15,000 - 18,000",Full Time Jobs,Delivery/Collections,"01 May 2025, 10:18 AM"
Delivery Boys,Flipkart,"Mohali - Kharar - Landran Road, Kharar, Sunny Enclave, Balongi","25,000 - 30,000",Full Time Jobs,Delivery/Collections - Courier-Delivery,"29 Apr 2025, 10:59 AM"
Delivery Boys,Flipkart,"Mohali - Kharar - Landran Road, Kharar Road, Kharar-Kurali Highway, Sunny Enclave + 1 more","25,000 - 30,000",Full Time Jobs,Delivery/Collections - Courier-Delivery,"29 Apr 2025, 10:59 AM"
JoBox is hiring for Recovery & Collection Officer RCO,JoBox Hire,"Chennai - T Nagar, Koyambedu, Anna Nagar, Nungambakkam + 1 more","35,000 - 40,000",Full Time Jobs,Delivery/Collections - Documents-Collection,"27 Apr 2025, 12:49 AM"
urgently hiring for delivery Executive in chennai,Not mentioned,"Chennai - Avadi, Poonamallee High Road, Kilkattalai, Mogappair + 1 more","20,000 - 25,000",Full Time Jobs,Delivery/Collections,"25 Apr 2025, 12:44 PM"
Delivery Boys,Flipkart,"Rupnagar - Anandpur Sahib, Bela Road","18,000 - 20,000",Full Time Jobs,Delivery/Collections - Courier-Delivery,"02 May 2025, 12:31 PM"
Courier delivery executive,Not mentioned,Salem - Fairlands,"10,000 - 15,000",Full Time Jobs,Delivery/Collections,"28 Apr 2025, 10:20 AM"
Delivery Executive Required - 7532801629,Flipkart,"Greaternoida - Pari Chowk, P3","16,500 - 17,500",Full Time Jobs,"Delivery/Collections - Courier-Delivery, Van-Delivery","25 Apr 2025, 02:34 PM"
Delivery Associates,One World Logistics Private Limited,"Sindhudurg - Kudal, Sawantwadi, Malvan, Kankavali","20,000 - 25,000",Full Time Jobs,"Delivery/Collections - Courier-Delivery, Other-Delivery/Collection, Van-Delivery, Courier/Packet-Collection","24 Apr 2025, 11:49 AM"
Delivery Boy Full time Salary 10k - 15k,abc,Bangalore - 100 Feet Road-Koramangala,"10,000 - 15,000",Full Time Jobs,Delivery/Collections - Food-Delivery,"12 Apr 2025, 02:57 PM"
Hiring- Delivery Boy || Location -Delhi-NCR || Salary Upto-25000 || Bike & Mobile Must ||,Not mentioned,"Delhi - Shalimar Bagh, Model Town, Burari, Mukundpur + 1 more","15,000 - 25,000",Full Time Jobs,"Delivery/Collections - Grocery-Delivery, Food-Delivery, Courier-Delivery, Other-Delivery/Collection + 4 more","08 Mar 2025, 06:04 PM"
Delivery Jobs || upto 60k package Available,Not mentioned,"Hyderabad - Bowenpally, Kukatpally, Panjagutta, Malkajgiri","12,000 - 20,000",Full Time Jobs,"Delivery/Collections - Grocery-Delivery, Food-Delivery, Courier-Delivery, Other-Delivery/Collection","05 Dec 2024, 10:30 AM"
Urgent requirement for delivery boy,Not mentioned,"Mumbai - Goregaon West, Chembur, Andheri West, Fort + 1 more","12,000 - 40,000",Full Time Jobs,"Delivery/Collections - Grocery-Delivery, Food-Delivery, Courier-Delivery, Courier/Packet-Collection","09 Sep 2024, 01:15 PM"
Hiring Delivery Executive||Salary upto-35000||Location Delhi- NCR,Not mentioned,"Delhi - Abul Fazal Enclave, Adhyapak Nagar, Adchini, Alaknanda + 1 more","35,000 - 36,000",Full Time Jobs,"Delivery/Collections - Grocery-Delivery, Food-Delivery, Courier-Delivery, Other-Delivery/Collection + 3 more","09 Aug 2024, 01:09 PM"
Delivery Executives|| Upto65k| | Spot Offer || Two Wheeler Must,Rajesh Logistics,"Hyderabad - Mehadipatnam, Kukatpally, Kondapur, Secunderabad + 1 more","12,000 - 65,000",Full Time Jobs,"Delivery/Collections - Grocery-Delivery, Food-Delivery, Courier-Delivery, Other-Delivery/Collection + 4 more","09 Aug 2024, 01:08 PM"
Hiring- Delivery Boy || Location -Delhi-NCR || Salary Upto-30000 || Bike & Mobile Must || Food & Courier Delivery ||,Not mentioned,"Delhi - Dwarka, Karol Bagh, Lajpat Nagar, Mukherjee Nagar + 1 more","10,000 - 30,000",Full Time Jobs,"Delivery/Collections - Grocery-Delivery, Food-Delivery, Courier-Delivery, Other-Delivery/Collection + 4 more","09 Aug 2024, 01:07 PM"
HIRING COLLECTION EXECUTIVES || BANKING SECTOR || BIKE MUST || BULK HIRING ||,Not mentioned,"Chennai - Anna Nagar, Adyar, Porur, Anna Salai + 1 more","25,000 - 35,000",Full Time Jobs,"Delivery/Collections - Grocery-Delivery, Food-Delivery, Courier-Delivery, Other-Delivery/Collection + 4 more","14 May 2024, 11:24 AM"
Urgently hiring for delivery boys,Confidential,"Chennai - Besant Nagar, Adambakkam, Agaram, Ashok Nagar + 1 more","20,000 - 30,000",Full Time Jobs,"Delivery/Collections - Grocery-Delivery, Food-Delivery, Courier-Delivery, Other-Delivery/Collection + 4 more","14 May 2024, 11:23 AM"
Requirement Of Delivery,Not mentioned,"Mumbai - Dadar, Andheri Kurla Road, Goregaon East, Byculla + 1 more","15,000 - 25,000",Full Time Jobs,"Delivery/Collections - Food-Delivery, Courier-Delivery, Cash-Collection, Documents-Collection","14 May 2024, 11:23 AM"
"Delivery, Loading and unloading",Not mentioned,"Nagpur - Gittikhadan, Pratap Nagar, Ambazari, Jaitala + 1 more","10,000 - 12,000",Full Time Jobs,Delivery/Collections,"04 May 2025, 01:28 AM"
Delivery Boys,Flipkart,"Rajpura - Dashmesh Colony, Focal Point, Gobind Colony, Ganesh Nagar + 4 more","25,000 - 30,000",Full Time Jobs,Delivery/Collections - Courier-Delivery,"03 May 2025, 10:28 PM"
Delivery person cum Helper,Crystal Clean Laundry,"Nashik - Serene Meadows, Anandvalli","10,000 - 12,000",Full Time Jobs,Delivery/Collections - Other-Delivery/Collection,"03 May 2025, 09:40 PM"
Driver -Tata Ace,Joseph & Co.,"Coimbatore - Madukarai, Sundarapuram, Kurichi, Malumichampatti + 1 more","17,000 - 18,000",Full Time Jobs,"Delivery/Collections - Grocery-Delivery, Food-Delivery","03 May 2025, 08:28 PM"
HIRING FOR DELIVERY EXECUTIVES,pemotech solution,"Chennai - Maduravoyal, Koyambedu, Virugambakkam, Thiruverkadu + 1 more","15,000 - 18,000",Full Time Jobs,"Delivery/Collections - Grocery-Delivery, Food-Delivery, Courier-Delivery, Other-Delivery/Collection + 4 more","03 May 2025, 08:27 PM"
Delivery collection,Not mentioned,"Tirupati - A P Housing Board Colony, Akkarampalle, AIR Bypass Road, Annasamipalle + 1 more","17,000 - 18,000",Full Time Jobs,Delivery/Collections,"03 May 2025, 06:47 PM"
Field executive,Not mentioned,"Ghaziabad - Mohan Nagar, Ghantaghar","12,500 - 14,500",Full Time Jobs,Delivery/Collections,"03 May 2025, 02:25 PM"
delivery rider,AVL projects,"Lucknow - Lucknow City, Lucknow Kanpur Road, Lucknow - Faizabad Road, Lucknow Cantonment + 1 more","21,000 - 25,000",Full Time Jobs,"Delivery/Collections - Grocery-Delivery, Food-Delivery","03 May 2025, 11:29 AM"
Delivery boy,Not mentioned,"Eastgodavari - Bikkavolu, Rangampeta","15,000 - 16,000",Full Time Jobs,Delivery/Collections,"03 May 2025, 11:16 AM"
Delivery boy,Not mentioned,"Nanded - Harsh Nagar, Wajegaon, CIDCO Colony, Borgaon + 1 more","15,000 - 40,000",Full Time Jobs,Delivery/Collections,"03 May 2025, 08:24 AM"
POLLACHI AND UDUMALAIPETTAI || REQUIREMENT FIELD COLLECTION EXECUTIVES || BANKING COLLECTION ||,GALAXY GROUPS,"Pollachi - Achipatti, Jeeva Nagar, Rathinasabapathy Puram, Venkatasa Colony + 1 more","15,000 - 20,000",Full Time Jobs,"Delivery/Collections - Other-Delivery/Collection, Cash-Collection, Recovery-Collection","03 May 2025, 05:45 AM"
field job,shiva,Delhi - Uttam Nagar,"14,000 - 18,000",Full Time Jobs,Delivery/Collections - Other-Delivery/Collection,"02 May 2025, 08:36 PM"
Delivery staff,Entery Automation PVT LTD,Thrissur - Kallur,"10,000 - 11,000",Full Time Jobs,Delivery/Collections - Other-Delivery/Collection,"02 May 2025, 08:31 PM"
Delivery boy,Not mentioned,"Agarmalwa - Chhawani, Awar, Sarafa Bazar","12,000 - 13,000",Full Time Jobs,Delivery/Collections,"02 May 2025, 05:51 PM"
Delivery Executive,Solaimalai Enterprises,Mannargudi - Ashesham,"1,000 - 10,500",Full Time Jobs,Delivery/Collections - Other-Delivery/Collection,"02 May 2025, 01:20 PM"
delivery riders,mini bharath,"Hubli - Sadhankeri, Dharwad Goa Road, Mukambika Nagar","15,000 - 16,000",Part Time Jobs,Delivery/Collections - Courier-Delivery,"02 May 2025, 01:13 PM"
Required field boy,individual,"Delhi - Shahdara, Dilshad Garden, Seemapuri, Seelampur + 1 more","15,000 - 18,000",Full Time Jobs,"Delivery/Collections - Grocery-Delivery, Food-Delivery, Other-Delivery/Collection, Courier/Packet-Collection","02 May 2025, 01:05 PM"
Two wheeler delivery job,Not mentioned,Trivandrum - Pattom,"16,000 - 30,000",Full Time Jobs,Delivery/Collections,"02 May 2025, 12:57 PM"
Delivery Boy,Hollywood Dry Cleaner,Kolkata - Bara Bazar,"10,000 - 25,000",Full Time Jobs,Delivery/Collections - Other-Delivery/Collection,"02 May 2025, 12:09 PM"
Courier Delivery Boy,Not mentioned,"Hyderabad - Mathrusree Nagar, Miyapur","10,000 - 12,000",Full Time Jobs,Delivery/Collections,"02 May 2025, 10:29 AM"
Itams delivery boy job,Not mentioned,"Nizamabad - Mudakpalli, Badsi, Borgaon P, Khanjar + 1 more","50,000 - 51,000",Full Time Jobs,Delivery/Collections,"02 May 2025, 04:40 AM"
Deliver boy.,Not mentioned,"Guwahati - Fancy Bazaar, Machkhowa","10,000 - 15,000",Full Time Jobs,Delivery/Collections,"01 May 2025, 06:34 PM"
Vendor Assessment,GemTech Paras,Delhi - Preet Vihar,"20,000 - 25,000",Full Time Jobs,Delivery/Collections - Documents-Collection,"01 May 2025, 04:39 PM"
Delivery Executive,Instakart Services PVt ltd,Ludhiana - Jalandhar Bye Pass Road,"15,000 - 30,000",Full Time Jobs,Delivery/Collections - Courier-Delivery,"01 May 2025, 03:34 PM"
Food Delivery Rider Shillong,Netfoodish,"Shillong - Malki, Nongmynsong, Nongthymmai, Bara Bazar + 1 more","10,000 - 30,000",Full Time Jobs,Delivery/Collections - Food-Delivery,"01 May 2025, 11:47 AM"
Delivery Boy,Dark Store,"Jaipur - Mansarovar, Jagatpura, Malviya Nagar, Vaishali Nagar + 1 more","25,000 - 35,000",Full Time Jobs,"Delivery/Collections - Grocery-Delivery, Food-Delivery, Courier-Delivery","01 May 2025, 09:24 AM"
Field Assistant Trainee -,Bharat Financial Inclusion Limited,"Lucknow - Alambagh, Faizabad Road, Lucknow - Faizabad Road","10,250 - 18,750",Full Time Jobs,"Delivery/Collections - Cash-Collection, Recovery-Collection","01 May 2025, 08:40 AM"
Van Sales,VR (Vita Revive) The Home Grown,Trivandrum - Pothencode,"10,000 - 15,000",Full Time Jobs,"Delivery/Collections - Grocery-Delivery, Other-Delivery/Collection, Van-Delivery","30 Apr 2025, 11:37 PM"
Delivery boy,Core corporates,"Gorakhpur - Betiahata, Golghar","13,500 - 14,500",Full Time Jobs,"Delivery/Collections - Grocery-Delivery, Courier-Delivery","30 Apr 2025, 12:30 PM"
CMS Is Urgently Hiring for Cash Pickup And Drop For ATM,CMS Infosystem Ltd,Rajkot - Full City,"12,000 - 16,000",Full Time Jobs,Delivery/Collections,"30 Apr 2025, 11:01 AM"
CMS Is Urgently Hiring for Cash Pickup And Drop For ATM,CMS Infosystem Ltd,"Surat - Barbodhan, Budiya, Dhamdod, Green Valley Road + 1 more","12,000 - 16,000",Full Time Jobs,"Delivery/Collections - Grocery-Delivery, Food-Delivery, Courier-Delivery, Other-Delivery/Collection + 4 more","30 Apr 2025, 11:00 AM"
Delivery executive needed urgently,Not mentioned,"Hazaribagh - Barkagaon Road, Hearngunj, Katkamsandi, Pabra","15,000 - 35,000",Full Time Jobs,Delivery/Collections,"30 Apr 2025, 10:16 AM"
Food delivery job in Kotturpuram,MAVE delivery,Chennai - Kotturpuram,"6,000 - 7,000",Full Time Jobs,Delivery/Collections - Food-Delivery,"30 Apr 2025, 09:38 AM"
DELIVERY EXECUTIVE,BLACK SWAN DRESS CARE AND RY CLEANERS,"Palakkad - Chandranagar Colony, Olavakkode, Chakkanthara, Kadamkod + 1 more","10,000 - 16,000",Full Time Jobs,Delivery/Collections,"30 Apr 2025, 07:09 AM"
Gas Delivery Man,Not mentioned,"Chennai - ECR, OMR, Adyar","9,000 - 12,000",Full Time Jobs,Delivery/Collections,"29 Apr 2025, 08:44 PM"
Drive ecco commercial,Not mentioned,Gurgaon - Acharya Puri Extension,"12,000 - 15,000",Full Time Jobs,Delivery/Collections,"29 Apr 2025, 02:30 PM"
Looking for Distributor for Premium Idly-Dosa Batter,Not mentioned,"Trivandrum - Balaramapuram, Aryankuzhi, Chenthitta, Attukulangara + 1 more","12,000 - 35,000",Full Time Jobs,Delivery/Collections,"29 Apr 2025, 12:03 PM"
Delivery Executive,Not mentioned,"Hyderabad - Njr Klr Nagar, Medchal","22,000 - 24,000",Full Time Jobs,Delivery/Collections,"29 Apr 2025, 11:27 AM"
Delivery Executive,Helixpro,Thrissur - Chalakudy,"9,000 - 10,000",Full Time Jobs,Delivery/Collections - Courier-Delivery,"29 Apr 2025, 11:13 AM"
Delivery man,Not mentioned,"Kannur - Kuthuparamba, Panoor, Mattannur, Anjarakandy + 1 more","35,000 - 44,000",Full Time Jobs,Delivery/Collections,"29 Apr 2025, 10:22 AM"
Delivery Executive,Not mentioned,"Thane - Kolbad, Khopat, Thane West","6,500 - 7,000",Full Time Jobs,Delivery/Collections,"29 Apr 2025, 09:00 AM"
Field Officer,Bharat Financial Inclusion Limited,"Varanasi - Ashapur, Chaubepur, Mirapur, Rajatalab + 1 more","10,250 - 18,750",Full Time Jobs,"Delivery/Collections - Cash-Collection, Recovery-Collection","28 Apr 2025, 09:36 PM"
Delivery Executive,Firstcry.com,"Ahmedabad - Vasna, Satellite","11,000 - 12,000",Full Time Jobs,Delivery/Collections - Courier-Delivery,"28 Apr 2025, 06:17 PM"
Grocery Delivery,FMCG,"Siliguri - Eastern Bypass, Babupara, Ghogomali","9,500 - 12,000",Full Time Jobs,Delivery/Collections - Grocery-Delivery,"28 Apr 2025, 05:37 PM"
Delivery boy job,Aikeens global solutions,Indore - Vijay Nagar,"15,000 - 25,000",Part Time Jobs,Delivery/Collections - Other-Delivery/Collection,"28 Apr 2025, 04:09 PM"
URGENT REQUIRED DELIVERY BOY AT SHADOWFAX,SHADOWFAX TECHNOLOGIES PRIVATE LIMITED,"Howrah - South Baksara, Belepole, Santragachi, Andul Road + 1 more","20,000 - 30,000",Full Time Jobs,"Delivery/Collections - Courier-Delivery, Other-Delivery/Collection, Van-Delivery, Courier/Packet-Collection","28 Apr 2025, 12:39 PM"
Delivery Boy,Firstcry.com,"Pune - Baner, Pimple Saudagar, Dange Chowk","14,000 - 14,700",Full Time Jobs,Delivery/Collections - Courier-Delivery,"28 Apr 2025, 10:34 AM"
Delivery Boys with 2+ Years Exp Required For Pharma Company in Mysore.,MM Enterprises,Mysore - KR Mohalla,"8,000 - 20,000",Full Time Jobs,Delivery/Collections - Other-Delivery/Collection,"27 Apr 2025, 06:58 PM"
Field Assistant,Not mentioned,"Howrah - Bally Khal, Bagnan, Andul Road, Ranihati","14,000 - 21,000",Full Time Jobs,Delivery/Collections - Cash-Collection,"26 Apr 2025, 07:22 PM"
Delivery Boys required across Padubidri,Not mentioned,"Udupi - Padubidri, Uchila, Yermal Thenka, Shirva + 1 more","25,000 - 30,000",Full Time Jobs,Delivery/Collections,"26 Apr 2025, 03:12 PM"
Full-Time Delivery Rider,Swiggy,"Secunderabad - Chilkalguda, Neredmet X Road, Old Neredmet, RTC Colony + 1 more","20,000 - 30,000",Full Time Jobs,Delivery/Collections - Food-Delivery,"26 Apr 2025, 12:30 PM"
DELIVERY BOY,Not mentioned,"Muzaffarpur - Sakra, Musahri, Sujawalpur, Dighra Rampur Shah","12,000 - 18,000",Full Time Jobs,Delivery/Collections,"26 Apr 2025, 06:45 AM"
Were Hiring Delivery Riders,meesho,Namakkal - Rasipuram,"25,000 - 35,000",Full Time Jobs,Delivery/Collections - Courier-Delivery,"25 Apr 2025, 07:03 PM"
Delivery boy,Not mentioned,"Cuttack - Bidanasi, CDA Sector-11, CDA Sector-6, CDA Sector-7 + 1 more","6,000 - 6,500",Full Time Jobs,Delivery/Collections,"25 Apr 2025, 06:34 PM"
VAN DELIVERY BOY,Not mentioned,Thiruvalla - Thukalassery,"12,000 - 15,000",Full Time Jobs,"Delivery/Collections - Other-Delivery/Collection, Van-Delivery, Cash-Collection","25 Apr 2025, 11:29 AM"
Delivery boy and sales,Not mentioned,Nawada - Warisaliganj,"20,000 - 25,000",Full Time Jobs,Delivery/Collections,"25 Apr 2025, 10:37 AM"
Delivery Partner,Not mentioned,"Kolhapur - Bhavani Mandap, Dewale, Jaysingpur, Laxmipuri + 1 more","30,000 - 35,000",Part Time Jobs,"Delivery/Collections - Grocery-Delivery, Food-Delivery, Other-Delivery/Collection, Courier/Packet-Collection","24 Apr 2025, 08:32 PM"
Delivery Boys needed urgently - Alandur,Not mentioned,"Chennai - Alandur, Guindy, Koyambedu, Pallavaram + 1 more","15,000 - 18,000",Full Time Jobs,Delivery/Collections - Courier-Delivery,"24 Apr 2025, 06:14 PM"
Delivery Boy Hiring,LOGISTIC,"Northlakhimpur - KB Road, NH 15","10,000 - 30,000",Full Time Jobs,Delivery/Collections,"24 Apr 2025, 05:57 PM"
Delivery Boy,Tesla Enterprise,Ahmedabad - Kathwada,"10,000 - 13,000",Full Time Jobs,Delivery/Collections - Other-Delivery/Collection,"24 Apr 2025, 01:07 PM"
Delivery executive,Not mentioned,"Chennai - Boat Club Area, Thiruverkadu, Pattabiram, Avadi + 1 more","6,000 - 6,500",Full Time Jobs,Delivery/Collections,"23 Apr 2025, 06:19 PM"
POLLACHI AND UDUMALAIPETTAI || REQUIREMENT FIELD COLLECTION EXECUTIVES || BANKING COLLECTION ||,GALAXY GROUPS,"Udumalpet - S V Puram, Bodipatti, Indra Nagar, Chinnaveerampatty + 2 more","15,000 - 20,000",Full Time Jobs,Delivery/Collections,"23 Apr 2025, 02:22 PM"
Delivery boy,ASSPL,"Ranchi - Bariatu, Lalpur, Kanke","14,000 - 18,000",Full Time Jobs,"Delivery/Collections - Grocery-Delivery, Courier-Delivery","23 Apr 2025, 12:40 PM"
Food Delivery Partner,Swiggy,"Mumbai - Ghatkopar East, Chembur, Borivali","15,000 - 25,000",Full Time Jobs,"Delivery/Collections - Grocery-Delivery, Food-Delivery","23 Apr 2025, 10:10 AM"
Delivery Manager,Hashtag Office,"Bangalore - JP Nagar, Jayanagar","14,000 - 16,000",Full Time Jobs,Delivery/Collections - Other-Delivery/Collection,"22 Apr 2025, 11:29 PM"
Delivery agents,Not mentioned,"Hyderabad - Srinagar Colony-Yousufguda, Kamalapuri Colony, Ameerpet, Banjara Hills + 1 more","8,000 - 15,000",Full Time Jobs,Delivery/Collections,"22 Apr 2025, 03:38 PM"
Delivery Executive,Crescat Consulting Pvt Ltd,Dubai,"80,000 - 99,999",Work Abroad,Delivery/Collections - Food-Delivery,"22 Apr 2025, 02:30 PM"
We hiring for Courier Delivery Executive In Chennai || Salary Upto 25000||,Sri Enterprises,"Chennai - Porur, Mogappair, Poonamallee, Neelankarai + 1 more","20,000 - 25,000",Full Time Jobs,Delivery/Collections - Courier/Packet-Collection,"22 Apr 2025, 10:31 AM"
Rider need argent,Not mentioned,"Rajahmundry - AV Appa Rao Road, Cycle Colony, Korukonda Road","12,000 - 13,000",Full Time Jobs,Delivery/Collections,"22 Apr 2025, 08:33 AM"
Delivery Boy,Queen Agencies,Ramanathapuram - Surankottai,"12,000 - 13,500",Full Time Jobs,Delivery/Collections - Grocery-Delivery,"21 Apr 2025, 07:23 PM"
Urgent Hiring Cash Executive,CMS,"Navimumbai - Airoli, Thane Belapur Road, Vashi, Digha Naka + 1 more","17,000 - 20,000",Full Time Jobs,"Delivery/Collections - Cash-Collection, Documents-Collection","21 Apr 2025, 07:15 PM"
Loan Recovery executive,Pivotal Management Pvt.Ltd.,Khagaria - Rahimpur Dakshin,"9,000 - 12,000",Full Time Jobs,Delivery/Collections - Recovery-Collection,"21 Apr 2025, 04:55 PM"
Collection Executives needed 3Nos,Not mentioned,"Coimbatore - Sulur, Karanampettai, Pappampatti, Irugur + 1 more","11,000 - 12,000",Full Time Jobs,Delivery/Collections,"21 Apr 2025, 02:19 PM"
Delivery Associate Required for Amazon Package Delivery,Not mentioned,Bhagalpur - Tilkamanjhi,"10,000 - 20,000",Full Time Jobs,"Delivery/Collections - Courier-Delivery, Other-Delivery/Collection, Van-Delivery, Courier/Packet-Collection","21 Apr 2025, 01:08 PM"
Urgent need delivery boys,Not mentioned,"Tiruvannamalai - Edapalayam, Tiruvannamalai - Thiyagadurgam Road, Adanur, Adayur + 1 more","15,000 - 30,000",Full Time Jobs,Delivery/Collections,"21 Apr 2025, 12:27 PM"
Paytm service executive,SGAGI,"Dehradun - Raipur Road, Shahastradhara Road, Prem Nagar, Dharampur Nehru Colony + 1 more","20,000 - 40,000",Full Time Jobs,"Delivery/Collections - Other-Delivery/Collection, Documents-Collection","21 Apr 2025, 11:05 AM"
Delivery Boy Job Application,The Great Art Printers,Mumbai - Full City,"12,000 - 15,000",Full Time Jobs,"Delivery/Collections - Other-Delivery/Collection, Documents-Collection","20 Apr 2025, 04:57 PM"
Meesho parcel delivery. Part time or full time workers needed. Per day 50 parcel only delivery.,Not mentioned,Thoothukudi - Kayathar,"15,000 - 30,000",Full Time Jobs,Delivery/Collections,"19 Apr 2025, 10:34 PM"
Meesho delivery,meesho,Thoothukudi - Kayathar,"20,000 - 30,000",Full Time Jobs,Not mentioned,"19 Apr 2025, 10:34 PM"
Meesho parcel delivery,Not mentioned,Thoothukudi - Kayathar,"15,000 - 30,000",Full Time Jobs,Not mentioned,"19 Apr 2025, 10:31 PM"
Delivery work,Not mentioned,"Bhilai - Kohka, Nehru Nagar West","12,000 - 15,000",Full Time Jobs,Not mentioned,"19 Apr 2025, 06:27 AM"
Urgent requirement delivery boy,Not mentioned,"Siwan - Tarwara, Basant Pur","15,000 - 20,000",Full Time Jobs,Not mentioned,"18 Apr 2025, 07:14 PM"
Delivery Boy,Blinkit,"Una - Hamirpur Road, Dhusara, Friends Colony, Mehatpur + 1 more","35,000 - 40,000",Full Time Jobs,Not mentioned,"18 Apr 2025, 06:07 PM"
Delivery boy,Network9 incorporate,"Thane - Ghodbandar, Ghantali, Kailash Colony, Kalwa + 1 more","25,000 - 35,000",Full Time Jobs,Not mentioned,"18 Apr 2025, 12:55 PM"
HIRING RECOVERY AGENTS FOR FIELD COLLECTION,CREDIT BOOSTERS/SARAH AGENCYES,"Chennai - Tambaram, Chengalpattu, Porur, Poonamallee + 1 more","20,000 - 25,000",Full Time Jobs,Not mentioned,"18 Apr 2025, 11:32 AM"
MEESHO delivery agent,Narendra,"Medak - Ramayampet, Chegunta, Narsingi","25,000 - 30,000",Full Time Jobs,Not mentioned,"17 Apr 2025, 12:53 PM"
Delivery boy,Not mentioned,Nawalgarh - Dhaka Ki Dhani,"15,000 - 18,000",Full Time Jobs,Not mentioned,"16 Apr 2025, 04:50 PM"
Cash Collecton Officer,AVANSH Consultants,"Ludhiana - Khanna, Doraha","15,000 - 20,000",Full Time Jobs,Not mentioned,"16 Apr 2025, 01:04 PM"
Urgent Hiring - Field Supervisor,CMS Info System Ltd,"Palakkad - Akathethara, Alanallur, Mankurussi, Pattambi + 1 more","4,000 - 14,000",Full Time Jobs,Not mentioned,"15 Apr 2025, 01:43 PM"
Collect cash,Not mentioned,"Bhimavaram - Juvvalapalem Road, Pedamiram","15,000 - 16,000",Full Time Jobs,Not mentioned,"14 Apr 2025, 11:07 PM"
Urgent Hiring For Delivery Partner,Mishra Solution,"Noida - Sector 63, Sector-117, Noida-Greater Noida Expressway, Sector 57","25,000 - 45,000",Full Time Jobs,Not mentioned,"14 Apr 2025, 09:52 PM"
Delivery Person,Sri Andal Agencies,"Coimbatore - Ramanathapuram, Singanallur, Singanallur-Vellalore Road, Sungam + 1 more","16,000 - 20,000",Full Time Jobs,Not mentioned,"12 Apr 2025, 10:44 AM"
"Wanted Delivery Staff, Amazing Salary, Free culture",Not mentioned,"Kumbakonam - Annai Anjugam Nagar, Chettimandapam, Kalimuthu Nagar, Darasuram + 1 more","15,000 - 18,000",Full Time Jobs,Not mentioned,"11 Apr 2025, 02:51 PM"
Delivery Boys required in Bolpur to Panagarh route,Bluedart Express Limited,Bolpursantiniketan - Santiniketan,"12,000 - 13,000",Full Time Jobs,Not mentioned,"11 Apr 2025, 08:53 AM"
field executive,Sunrise Associates,Mandya - Malavalli,"12,000 - 15,000",Full Time Jobs,Not mentioned,"09 Apr 2025, 03:25 PM"
City Mall Delevery,Not mentioned,"Mughalsarai - Mughalsarai Rly Settlement, Patel Nagar, Ravi Nagar, Manas Nagar + 1 more","18,000 - 25,000",Full Time Jobs,Not mentioned,"09 Apr 2025, 01:22 PM"
Delivery boy,Not mentioned,Hisar - Hisar Cantt,"25,000 - 30,000",Full Time Jobs,Not mentioned,"09 Apr 2025, 10:22 AM"
Delivery boy,Not mentioned,"Jalore - Mudtra Sili, Sarat, Narmada Colony, Shivaji Nagar Colony","15,000 - 16,000",Full Time Jobs,Not mentioned,"09 Apr 2025, 10:01 AM"
URGENT VACANCY FIELD COLLECTION OFFICER FOR BANKING RECOVERY COLLECTION,VAISHNAVI MANAGEMENT PVT LTD,"Secunderabad - Shiva Nagar, Paradise Circle, Old Neredmet, Chilkalguda + 1 more","10,000 - 18,000",Full Time Jobs,Not mentioned,"08 Apr 2025, 12:19 PM"
Collection delivery,Not mentioned,"Kondagaon - Chikhalputi, Bazar Para","10,000 - 11,000",Full Time Jobs,Not mentioned,"08 Apr 2025, 10:07 AM"
Rider-Delivery Partner,Shadowfax,"Chennai - Guindy, Ashok Nagar, Saidapet","25,000 - 35,000",Full Time Jobs,Not mentioned,"08 Apr 2025, 06:49 AM"
"Night job security, peteolpump",Not mentioned,Gandhidham - Adipur,"15,000 - 16,000",Full Time Jobs,Not mentioned,"07 Apr 2025, 09:19 PM"
Delivery Boy,Not mentioned,Bangalore - BEML Layout Raja Rajeshwari Nagar,"13,000 - 15,000",Full Time Jobs,Not mentioned,"07 Apr 2025, 01:30 PM"
Delevery boy,Not mentioned,Rupnagar - Anandpur Sahib,"15,000 - 16,000",Full Time Jobs,Delivery/Collections,"07 Apr 2025, 11:15 AM"
Sales executive,Not mentioned,"Jeypore - Parabeda, Ambaguda, Jay Nagar, Panchabati Nagar","12,000 - 13,000",Full Time Jobs,Delivery/Collections,"07 Apr 2025, 10:35 AM"
Courier Delivery Rider,Countryside Express Logistics Pvt. Ltd.,Mohali - Sector 71,"18,000 - 22,000",Full Time Jobs,Delivery/Collections - Courier-Delivery,"06 Apr 2025, 03:18 PM"
Delivery boy,Not mentioned,"Rajapalayam - Intuc Nagar, Tenkasi Road","10,000 - 25,000",Full Time Jobs,Delivery/Collections,"06 Apr 2025, 09:52 AM"
Need Delivery Boys in Jaisalmer,Flipkart,"Jaisalmer - Gandhi Colony, Mohangarh, Malka Pol, Darbariyon Ka Gaon","20,000 - 35,000",Full Time Jobs,"Delivery/Collections - Grocery-Delivery, Food-Delivery, Courier-Delivery, Other-Delivery/Collection + 1 more","05 Apr 2025, 12:15 PM"
Delivery Executive,Integro International,Mumbai - Mumbai Central,"10,000 - 12,000",Full Time Jobs,Delivery/Collections - Other-Delivery/Collection,"05 Apr 2025, 09:05 AM"
Urgent Hiring - Field Executive,CMS Info System Ltd,"Kozhikode - Kannur Road, Malaparamba, Wayanad Road, Arayidathupalam + 1 more","3,000 - 10,000",Full Time Jobs,Delivery/Collections - Cash-Collection,"03 Apr 2025, 09:50 PM"
Seller picup,flipkart,Barasat,"18,000 - 22,000",Full Time Jobs,"Delivery/Collections - Courier-Delivery, Van-Delivery, Courier/Packet-Collection, Cash-Collection","03 Apr 2025, 02:22 PM"
