title,company,location,salary,job_type,description,posted_date
SALES EXECUTIVE || IMMEDIATE HIRING || SALARY UPTO 50000,WINSPARK INNOVATIONS LEARNING PRIVATE LIMITED,"Patna - Bakerganj, Biscomaun Colony, Ekta Nagar, Kankarbagh + 1 more","28,000 - 50,000",Full Time Jobs,Sales,"03 May 2025, 03:52 PM"
Hiring Telecalling executive Bangalore,IAMT GLOBAL ACADEMY,"Bangalore - Jayanagar, Bangalore Bazaar","18,000 - 30,000",Full Time Jobs,"Sales - ED-Tech-Sales, Telecom","03 May 2025, 03:42 PM"
JoBox is hiring for field sales executive,Jobox Hire,"Bangalore - Koramangala, BTM Layout, Shivaji Nagar, Indira Nagar + 1 more","30,000 - 33,000",Full Time Jobs,Sales,"03 May 2025, 12:33 PM"
Industrial Marketing of Hardware Items,KRISHNA BEARINGS,"Faridabad - Sanjay Colony, Ballabhgarh, Dabua Colony, Jawahar Colony + 1 more","15,000 - 16,000",Full Time Jobs,"Sales - Manufacturing, B2B-sales, Industrial-Sales","02 May 2025, 10:17 AM"
SALES EXECUTIVE || IMMEDIATE HIRING || SALARY UPTO 50000,WINSPARK INNOVATIONS LEARNING PRIVATE LIMITED,"Coimbatore - Anantha Nagar, Avarampalayam Road, Coimbatore Airport, EB Colony + 1 more","28,000 - 50,000",Full Time Jobs,Sales,"01 May 2025, 07:45 PM"
SALES EXECUTIVE || IMMEDIATE HIRING || SALARY UPTO 50000,WINSPARK INNOVATIONS LEARNING PRIVATE LIMITED,"Kolkata - Anandapur, Baithakkhana, Bedia Danga, Bowbazar + 1 more","28,000 - 50,000",Full Time Jobs,Sales,"29 Apr 2025, 07:19 PM"
Pharmacist Assistant,Thulasi Pharmacies India Private Limited,"Coimbatore - Thudiyalur, Ganapathy, Saravanampatti, PN Pudur + 1 more","12,000 - 15,000",Full Time Jobs,Sales - Pharma,"29 Apr 2025, 11:29 AM"
Business Development Associate || IMMEDIATE HIRING || SALARY UPTO 50000,WINSPARK INNOVATIONS LEARNING PRIVATE LIMITED,"Mysore - Banooru, Earangere, Hunsur Road, Krs Road + 1 more","28,000 - 50,000",Full Time Jobs,Sales,"28 Apr 2025, 11:23 AM"
Business Development Associate || IMMEDIATE HIRING || SALARY UPTO 50000,WINSPARK INNOVATIONS LEARNING PRIVATE LIMITED,"Kota - Indraprastha Industrial Area, Rama Krishna Puram, Vigyan Nagar, Vallabh Bari + 1 more","28,000 - 50,000",Full Time Jobs,Sales,"28 Apr 2025, 11:23 AM"
Business Development Associate || IMMEDIATE HIRING || SALARY UPTO 50000,WINSPARK INNOVATIONS LEARNING PRIVATE LIMITED,"Surat - Chapprabhatta, Hazira - Adajan Road, Kim, Rander + 1 more","28,000 - 50,000",Full Time Jobs,Sales,"28 Apr 2025, 11:23 AM"
Business Development Associate || IMMEDIATE HIRING || SALARY UPTO 50000,WINSPARK INNOVATIONS LEARNING PRIVATE LIMITED,"Mohali - Khera, Sector 117, Sector 80, Sector-82 + 1 more","28,000 - 50,000",Full Time Jobs,Sales,"28 Apr 2025, 10:54 AM"
Business Development Associate || IMMEDIATE HIRING || SALARY UPTO 50000,WINSPARK INNOVATIONS LEARNING PRIVATE LIMITED,"Noida - Sector 86, Sector 149, Sector 69, Sector-151 + 1 more","28,000 - 50,000",Full Time Jobs,Sales,"28 Apr 2025, 10:53 AM"
SALES EXECUTIVE || IMMEDIATE HIRING || SALARY UPTO 50000,WINSPARK INNOVATIONS LEARNING PRIVATE LIMITED,"Lucknow - Aminabad Park, Barkhurdarpur, CIMAP, Fazullaganj + 1 more","28,000 - 50,000",Full Time Jobs,Sales,"28 Apr 2025, 10:43 AM"
SALES EXECUTIVE || IMMEDIATE HIRING || SALARY UPTO 50000,WINSPARK INNOVATIONS LEARNING PRIVATE LIMITED,"Trichy - Crawford Colony, Kulumani, Palayam Bazar, Sarkarpalayam Village + 1 more","28,000 - 50,000",Full Time Jobs,Sales,"28 Apr 2025, 10:41 AM"
SALES EXECUTIVE || IMMEDIATE HIRING || SALARY UPTO 50000,WINSPARK INNOVATIONS LEARNING PRIVATE LIMITED,"Vizag - Ayyappa Nagar, Dabbanda, HB Colony, Kamala Nagar Colony + 1 more","28,000 - 50,000",Full Time Jobs,Sales,"28 Apr 2025, 10:38 AM"
SALES EXECUTIVE || IMMEDIATE HIRING || SALARY UPTO 50000,WINSPARK INNOVATIONS LEARNING PRIVATE LIMITED,"Vadodara - Ampad, Chokshi Bazar, Karjan, Padra + 1 more","28,000 - 50,000",Full Time Jobs,Sales,"28 Apr 2025, 10:38 AM"
SALES EXECUTIVE || IMMEDIATE HIRING || SALARY UPTO 50000,WINSPARK INNOVATIONS LEARNING PRIVATE LIMITED,"Kochi - Chambakkara - Kannadikadu Road, Edavoor, Eroor, Kaloor + 1 more","28,000 - 50,000",Full Time Jobs,Sales,"28 Apr 2025, 10:37 AM"
SALES EXECUTIVE || IMMEDIATE HIRING || SALARY UPTO 50000,WINSPARK INNOVATIONS LEARNING PRIVATE LIMITED,"Gurgaon - Bhangrola, Defence Colony, Islampur Village, Mayfield Garden + 1 more","28,000 - 50,000",Full Time Jobs,Sales,"28 Apr 2025, 10:36 AM"
SALES EXECUTIVE || IMMEDIATE HIRING || SALARY UPTO 50000,WINSPARK INNOVATIONS LEARNING PRIVATE LIMITED,"Jaipur - Anand Lok, Bhawani Singh Road, Dahar Ka Balaji, Gokulpura + 1 more","28,000 - 50,000",Full Time Jobs,Sales,"28 Apr 2025, 10:36 AM"
SALES EXECUTIVE || IMMEDIATE HIRING || SALARY UPTO 50000,WINSPARK INNOVATIONS LEARNING PRIVATE LIMITED,"Bhubaneswar - Andharua, Beguniabarahi, Chak, Ebaranga + 1 more","28,000 - 50,000",Full Time Jobs,Sales,"28 Apr 2025, 10:36 AM"
Nandi Toyota Is Hiring for Sales Consultant,Motorworld private limited,Bangalore - Full City,"20,000 - 35,000",Full Time Jobs,"Sales - Health, Real-estate, IT, Banking-&-Financial-Services + 28 more","25 Apr 2025, 05:50 PM"
CUSTOMER RELATIONSHIP EXECUTIVE,Vodafone,"Kochi - Kakkanad, Thoppumpady, Panampilly Nagar, Palarivattom + 1 more","16,000 - 18,000",Full Time Jobs,Sales,"25 Apr 2025, 11:47 AM"
Business Development Executive for selling ophthalmology products in Delhi,Not mentioned,"Delhi - AIIMS, Preet Vihar, Karol Bagh, Vasant Kunj + 1 more","25,000 - 40,000",Full Time Jobs,Sales,"25 Apr 2025, 10:20 AM"
Field Sales Executive in Chennai for a reputed E commerce company,For a reputed Private company,Chennai - Full City,"20,000 - 20,000",Full Time Jobs,Sales,"25 Apr 2025, 10:20 AM"
URGENT HIRING FOR FIELD SALES EXECUTIVE IN NAGARABHAVI,FenTech Windows And Doors,"Bangalore - Nagarabhavi, Magadi Road, Vijaya Nagar, Mysore Road + 1 more","15,000 - 18,000",Full Time Jobs,"Sales - Consumer Durables, Solar-System-Sales, Construction-equipments, Plywood-Sales + 6 more","03 May 2025, 09:43 PM"
"Immediately looking for Sales || Salary upto 20000 || Branches at Malleswaram, Marathahalli, Kamanahalli, Brookefield",Laptop Store,Bangalore,"12,000 - 20,000",Full Time Jobs,"Sales - Industrial-Sales, Insurance, Retail, Laptop/Mobile + 1 more","03 May 2025, 08:57 PM"
URGENT HIRING Sales Executive - Marketing Sales and Marketing,Nippen Electrical Instruments Co.,Chennai,"40,000 - 50,000",Full Time Jobs,"Sales - Health, Real-estate, IT, Banking-&-Financial-Services + 28 more","02 May 2025, 06:05 PM"
SALES EXECUTIVE || IMMEDIATE HIRING || SALARY UPTO 50000,WINSPARK INNOVATIONS LEARNING PRIVATE LIMITED,Delhi,"28,000 - 50,000",Full Time Jobs,Sales,"02 May 2025, 03:51 PM"
Sales Executive,Namishree Group,Hyderabad,"25,000 - 70,000",Full Time Jobs,"Sales - Manufacturing, B2B-sales, Cement/-Concrete-Sales","02 May 2025, 01:51 PM"
Business Development Associate || IMMEDIATE HIRING || SALARY UPTO 50000,WINSPARK INNOVATIONS LEARNING PRIVATE LIMITED,Guwahati,"28,000 - 50,000",Full Time Jobs,Sales,"02 May 2025, 10:55 AM"
Relationship Manager,Kalyani motors,Bangalore,"16,000 - 20,000",Full Time Jobs,Sales - FMCG,"01 May 2025, 05:43 PM"
Require Marketing Executive in Packaging Company,Amartara Pvt Ltd,Mumbai,"25,000 - 30,000",Full Time Jobs,Sales - Manufacturing,"01 May 2025, 02:38 PM"
Loan Sales Executive Commercial Vehicles,Evate Technologies,Bangalore,"12,000 - 13,000",Full Time Jobs,Sales - Banking-&-Financial-Services,"01 May 2025, 02:15 AM"
SALES EXECUTIVE || IMMEDIATE HIRING || SALARY UPTO 50000,WINSPARK INNOVATIONS LEARNING PRIVATE LIMITED,Mumbai,"28,000 - 50,000",Full Time Jobs,Sales,"01 May 2025, 12:35 AM"
Bussiness Developement Managers || Anandbagh || Upto 30k ||,S S FINANCIAL MANAGEMENT CONSULTANCY PVT LTD,Hyderabad,"15,000 - 30,000",Full Time Jobs,"Sales - Health, Real-estate, IT, Banking-&-Financial-Services + 28 more","30 Apr 2025, 06:38 PM"
Business Development Associate || IMMEDIATE HIRING || SALARY UPTO 50000,WINSPARK INNOVATIONS LEARNING PRIVATE LIMITED,Bangalore,"28,000 - 50,000",Full Time Jobs,Sales,"30 Apr 2025, 01:06 PM"
SALES EXECUTIVE || IMMEDIATE HIRING || SALARY UPTO 50000,WINSPARK INNOVATIONS LEARNING PRIVATE LIMITED,Chennai,"28,000 - 50,000",Full Time Jobs,Sales,"30 Apr 2025, 12:55 AM"
Hiring for Sales Officers - Hyderabad,Ninjacart,Hyderabad,"25,000 - 30,000",Full Time Jobs,"Sales - FMCG, Food-and-Beverage-Sales, B2B-sales, E-Commerce","29 Apr 2025, 06:27 PM"
Business Development Associate || IMMEDIATE HIRING || SALARY UPTO 50000,WINSPARK INNOVATIONS LEARNING PRIVATE LIMITED,Hyderabad,"28,000 - 50,000",Full Time Jobs,Sales,"29 Apr 2025, 02:42 PM"
Urgent Hiring For Sale Exucutive,Khed Logistics Park India LLP,Pune,"12,000 - 25,000",Full Time Jobs,Sales,"28 Apr 2025, 04:10 PM"
Business Development Associate || IMMEDIATE HIRING || SALARY UPTO 50000,WINSPARK INNOVATIONS LEARNING PRIVATE LIMITED,Srinagar,"28,000 - 50,000",Full Time Jobs,Sales,"28 Apr 2025, 11:23 AM"
Business Development Associate || IMMEDIATE HIRING || SALARY UPTO 50000,WINSPARK INNOVATIONS LEARNING PRIVATE LIMITED,Hyderabad,"28,000 - 50,000",Full Time Jobs,Sales,"28 Apr 2025, 11:20 AM"
SALES EXECUTIVE || IMMEDIATE HIRING || SALARY UPTO 50000,WINSPARK INNOVATIONS LEARNING PRIVATE LIMITED,Madurai,"28,000 - 50,000",Full Time Jobs,Sales,"28 Apr 2025, 10:43 AM"
Customer executive Support,Dhani properties,Bangalore,"18,000 - 25,000",Full Time Jobs,"Sales - Real-estate, Banking-&-Financial-Services, Telecom","28 Apr 2025, 10:40 AM"
JoBox is hiring for Customer Relationship Manager CREM,JoBox Hire,Chennai,"30,000 - 40,000",Full Time Jobs,"Sales - Health, Real-estate, IT, Banking-&-Financial-Services + 28 more","27 Apr 2025, 06:26 AM"
Vibez Estate is hring for Inside Sales Specialist,VIBEZ ESTATES,Bangalore,"22,000 - 32,000",Full Time Jobs,"Sales - Real-estate, IT, ED-Tech-Sales, B2B-sales + 3 more","26 Apr 2025, 04:26 PM"
JoBox is hiring for Business Development Executive BDE Branch Banking,JoBox Hire,Chennai,"30,000 - 40,000",Full Time Jobs,"Sales - Health, Real-estate, IT, Banking-&-Financial-Services + 28 more","26 Apr 2025, 11:06 AM"
person should take care the store n sales,Not mentioned,Bangalore,"13,000 - 16,000",Full Time Jobs,Sales - Retail,"24 Apr 2025, 12:11 PM"
Field Assistant Trainee,BHARAT FINANCIAL INCLUSION LTD.,Shamli,"10,000 - 15,000",Full Time Jobs,Sales,"24 Apr 2025, 11:50 AM"
Sales Executive Required,Dr. Karthi Chit India Pvt Ltd,Gobichettipalayam,"15,000 - 20,000",Full Time Jobs,Sales,"18 Apr 2025, 04:43 PM"
IMMEDIATE HIRING FOR EXPERIENCED SALES & MARKETING CANDIDATES WITH ATTRACTIVE SALARY,QUIKR INDIA PVT. LTD.,"Bangalore - Yelahanaka, Nagavara, Vijaya Nagar, Malleshwaram + 1 more","20,000 - 30,000",Full Time Jobs,"Sales - Real-estate, Construction-equipments, Manufacturing, B2B-sales + 5 more","12 Apr 2025, 02:58 PM"
IMMEDIATE HIRING FOR B2B SALES FOR QUIKR,QUIKR INDIA PVT LTD,"Bangalore - Nagavara, Thanisandra, Hebbal, Yelahanka + 1 more","25,000 - 35,000",Full Time Jobs,Sales - B2B-sales,"12 Apr 2025, 02:58 PM"
Immediately looking for Telesales Executive || Salarty upto 25k,Quikr India Pvt Ltd,"Bangalore - Hebbal, Yelahanka, Hennur, Jalahalli + 1 more","20,000 - 25,000",Full Time Jobs,"Sales - B2B-sales, E-Commerce","12 Apr 2025, 02:57 PM"
Hiring Sales Executive || Salary upto -25000 || Location- Delhi NCR ||,Not mentioned,"Delhi - Pitampura, Rohini, Paschim Vihar, Janakpuri + 1 more","15,000 - 25,000",Full Time Jobs,"Sales - Health, Real-estate, IT, Banking-&-Financial-Services + 28 more","08 Mar 2025, 06:04 PM"
Urgent hiring for sale executive,Quikr,"Bangalore - Govindapura, Kaval Bairasandra, Bammanahalli-Devanahalli, RT Nagar + 1 more","20,000 - 40,000",Full Time Jobs,Sales,"08 Mar 2025, 06:04 PM"
Urgent Hiring for Key Account Manager- Field Sales - With Attractive salary + Incentive,Quikr.Com,"Bangalore - Lingaraja Puram, RT Nagar, KR Puram, Hennur Main Road + 1 more","35,000 - 45,000",Full Time Jobs,"Sales - Health, Real-estate, IT, Banking-&-Financial-Services + 28 more","10 Feb 2025, 12:39 PM"
Counter Sales Staff Jewelry Showroom Across Hyderabad,Not mentioned,"Hyderabad - Bowenpally, Chintal, Malkajgiri, Kukatpally","12,000 - 13,000",Full Time Jobs,Sales,"05 Dec 2024, 10:30 AM"
Immediately looking for a sales executive in and around Bangalore salary upto 25000.,Not mentioned,"Bangalore - AMS Layout, Ashok Nagar, BTM Layout 2nd Stage, Bellandur + 1 more","25,000 - 30,000",Full Time Jobs,Sales - ED-Tech-Sales,"07 Oct 2024, 09:26 AM"
QuikrJobs is hiring for Field and Inside Sales Executives for Corporate Sales,QUIKRJOBS,"Mumbai - Andheri Kurla Road, Sakinaka, Chandivali, Rambaug + 1 more","20,000 - 35,000",Full Time Jobs,Sales,"09 Sep 2024, 12:33 PM"
QuikrJobs is hiring for Inside Sales Executives,Quikr India Pvt Ltd,"Bangalore - RT Nagar, HRBR Layout, Yelahanaka, KR Puram + 1 more","20,000 - 30,000",Full Time Jobs,"Sales - Health, Real-estate, IT, Banking-&-Financial-Services + 28 more","09 Sep 2024, 12:33 PM"
Wanted sales executive for our company,Not mentioned,"Chennai - Egmore, Kilpauk, Anna Nagar, Maduravoyal + 1 more","10,000 - 22,000",Full Time Jobs,"Sales - Health, Real-estate, IT, Banking-&-Financial-Services + 28 more","22 Aug 2024, 12:37 PM"
We are looking for sales representative || salary up to - 28000 || location - Noida || Bike & license,quikr.com,"Noida - Atta, Salarpur, Khora Colony, Mamura + 1 more","27,000 - 28,000",Full Time Jobs,"Sales - Health, Real-estate, FMCG, Consumer Durables + 5 more","10 Aug 2024, 12:14 PM"
Hiring Sales Executive || Salary upto -34000 || Location- Delhi NCR || Bike &Laptop- Must ||,Not mentioned,"Delhi - Uttam Nagar, Rohini, Sarita Vihar, Patel Nagar + 1 more","20,000 - 34,000",Full Time Jobs,"Sales - Health, Real-estate, IT, Banking-&-Financial-Services + 28 more","09 Aug 2024, 01:08 PM"
Hiring for BPO Voice process Qualifications 12th Languages English and kannada,quikr,"Bangalore - Malleshwaram, Yeshwanthpur, Gayathrinagar, Shrirampuram + 1 more","25,000 - 35,000",Full Time Jobs,"Sales - Banking-&-Financial-Services, B2B-sales","09 Aug 2024, 01:07 PM"
10 Sales Executive required on Urgent Basis,Not mentioned,"Delhi - Abul Fazal Enclave, Mehrauli - Badarpur Road, Badarpur, Lal Kot + 1 more","10,000 - 15,000",Full Time Jobs,Sales,"17 Jul 2024, 12:46 PM"
Urgent hiring for sales executive || Sal upto 22K,Not mentioned,"Kolkata - 4 No. Bridge, AK Mukherjee Road, Baguiati, Dum Dum + 1 more","17,000 - 22,000",Full Time Jobs,"Sales - Others, B2B-sales","14 May 2024, 11:55 AM"
urgent hiring || tele sales|| sal 15k to 20k,Not mentioned,"Kolkata - 4 No. Bridge, Barasat, Hazra, Newtown + 1 more","15,000 - 25,000",Full Time Jobs,"Sales - Health, IT, FMCG, Others + 1 more","14 May 2024, 11:23 AM"
Sales Executive,Not mentioned,"Mumbai - Mankhurd, Asangaon, Ambernath, Dadar + 1 more","15,000 - 25,000",Full Time Jobs,Sales,"14 May 2024, 11:23 AM"
FIELD SALES EXECUTIVES || FRESHER & EXPERIENCED CANDIDATES || SALARY 35K PER MONTH ||,Not mentioned,"Chennai - Anna Nagar, Tambaram, Poonamallee, Madhavaram + 1 more","25,000 - 35,000",Full Time Jobs,"Sales - Health, Real-estate, IT, Banking-&-Financial-Services + 28 more","14 May 2024, 11:22 AM"
Field Sales Executive,Not mentioned,"Bangalore - 80 Ft. Road, Bellandur, Bellary Road, Banashankari + 1 more","20,000 - 25,000",Full Time Jobs,"Sales - Banking & Financial Services, Consumer Durables, FMCG, Retail","26 Apr 2025, 03:51 PM"
Field sales Executive,Not mentioned,"Hyderabad - Gachibowli, Gandhi Nagar, Hi Tech City, Himayat Nagar + 1 more","20,000 - 25,000",Full Time Jobs,"Sales - Banking & Financial Services, Consumer Durables, FMCG, Retail","25 Apr 2025, 09:38 PM"
Sales women,Not mentioned,"Agartala - Central Road, Shibnagar","9,000 - 9,500",Full Time Jobs,Sales,"04 May 2025, 02:24 AM"
Telecaller executive,Inrext pvt ltd,"Noida - Atta, Baraula","10,000 - 16,000",Full Time Jobs,Sales - Real-estate,"04 May 2025, 01:45 AM"
Inside Sales Executive,FiceConnect,Noida - Sector 62,"20,000 - 40,000",Full Time Jobs,"Sales - IT, B2B-sales","04 May 2025, 01:45 AM"
we are hiring,IMPERIA STRUCTURES LTD,"Noida - Sector 15, Sector 26, Sector 49, Sector 47 + 1 more","15,000 - 25,000",Full Time Jobs,Sales - Real-estate,"04 May 2025, 01:45 AM"
On field sales and marketing,Not mentioned,Ahmednagar - MIDC,"12,000 - 14,000",Full Time Jobs,"Sales - Manufacturing, B2B-sales, Industrial-Sales","04 May 2025, 12:40 AM"
Icecream n namkeen items,Not mentioned,"Guwahati - Bamunimaidan, Hatigarh Chariali, Kharghuli Hills, Noonmati + 1 more","18,500 - 22,000",Full Time Jobs,Sales,"04 May 2025, 12:23 AM"
Sale executives,Not mentioned,"Coimbatore - Ganapathi Maanagar, Gandhipuram, Athipalayam, Saravanampatti + 1 more","13,000 - 18,000",Full Time Jobs,Sales,"03 May 2025, 11:33 PM"
COUNTER SALES,BHARAT ELECTRIC CORPORATION,Delhi - New Mahavir Nagar,"10,000 - 12,000",Full Time Jobs,Sales,"03 May 2025, 11:12 PM"
Sales and Marketing Intern,Not mentioned,Trivandrum - Technopark,"1,000 - 6,500",Full Time Jobs,Sales,"03 May 2025, 11:03 PM"
PART TIME SALES JOB,INAVARAP,"Coimbatore - Avinashi Road, Gandhipuram, Kattampatti","20,000 - 40,000",Part Time Jobs,"Sales - Others, B2B-sales","03 May 2025, 10:07 PM"
tele sales,KAIG Group,Bangalore - Sahakara Nagar,"17,000 - 20,000",Full Time Jobs,Sales - Real-estate,"03 May 2025, 10:05 PM"
solar sales executive,Geopower India Private Limited,Delhi - South Delhi,"25,000 - 35,000",Full Time Jobs,Sales - Solar-System-Sales,"03 May 2025, 08:57 PM"
CASA sales officer,Career_Vista,Udaipur - Full City,"15,000 - 16,000",Full Time Jobs,Sales - Banking-&-Financial-Services,"03 May 2025, 08:28 PM"
CASA sales officer,Career_Vista,"Dungarpur - Sagwara, Bichhiwara, Galiyakot, Shivaji Nagar","16,500 - 17,500",Full Time Jobs,Sales - Banking-&-Financial-Services,"03 May 2025, 08:28 PM"
Sales & Marketing Manager,Trelum Lighting LLP / Munilal Vinod & Co,"Coimbatore - Sukrawar Pettai, Avinashi Road, RS Puram, Town Hall + 1 more","17,500 - 50,000",Full Time Jobs,"Sales - Others, Solar-System-Sales, Manufacturing, B2B-sales + 3 more","03 May 2025, 08:27 PM"
Field Sales Associate,Not mentioned,"Jammu - Katra, Akhnoor, Miran Sahib, Bari Brahmana + 1 more","12,000 - 18,000",Full Time Jobs,Sales,"03 May 2025, 08:14 PM"
Field Sales Executive,Not mentioned,"Bangalore - Kanakapura, Bilekahalli, Garvebhavi Palya, Hennur + 1 more","20,000 - 24,500",Full Time Jobs,Sales,"03 May 2025, 07:47 PM"
Agency Manager,Not mentioned,"Aurangabad - Chhatrapati Nagar, Aurangpura, Ajab Nagar, Bajaj Nagar + 1 more","35,000 - 36,000",Full Time Jobs,Sales,"03 May 2025, 07:30 PM"
Field Sales Executivr,Not mentioned,"Bangalore - Laggere, Yelahanaka, Basaweshwara Nagar, RR Nagar + 1 more","20,000 - 24,500",Full Time Jobs,Sales,"03 May 2025, 07:11 PM"
Customer Care Executive,Lakhu TeleServices PVT LTD,Ahmedabad - Sola,"10,000 - 18,000",Full Time Jobs,"Sales - Others, Telecom","03 May 2025, 06:05 PM"
customer service executive,lenka infra services pvt ltd,Bhubaneswar - Pipili,"10,000 - 11,000",Work From Home,Sales - Real-estate,"03 May 2025, 04:53 PM"
Sales and business development,Not mentioned,"Mumbai - Grant Road, Tardeo","25,000 - 35,000",Full Time Jobs,Sales - B2B-sales,"03 May 2025, 04:20 PM"
Sales Executive,Finotive Solutions,"Chennai - Velachery, Chromepet, T Nagar, Kodambakkam + 1 more","15,000 - 20,000",Full Time Jobs,Sales - Jewellery,"03 May 2025, 03:44 PM"
SALES EXECUTIVE,NJL-HOUSE OF JEWELLERY,Ahmedabad - CG Road,"15,000 - 25,000",Full Time Jobs,Sales - Jewellery,"03 May 2025, 03:30 PM"
Store Supervisor,Detailing Bull,Gurgaon - Sector 57,"18,000 - 25,000",Full Time Jobs,"Sales - Retail, Automobile","03 May 2025, 03:29 PM"
Sales Fresher,Not mentioned,"Mumbai - Borivali, Aarey Road, Andheri East, Carter Road + 1 more","7,000 - 8,000",Full Time Jobs,Sales,"03 May 2025, 02:47 PM"
Counter salesman,Not mentioned,"Gwalior - Morar, Tekanpur","6,000 - 12,000",Full Time Jobs,Sales,"03 May 2025, 01:13 PM"
Sales & Marketing Executive IT Solutions,Not mentioned,Madurai - Madurai Main,"15,000 - 20,000",Full Time Jobs,Sales,"03 May 2025, 12:49 PM"
CAR DRIVER,OTTO TAPES & EQUIPMENTS MFG CO llp,"Navimumbai - Airoli, Sector 6 Airoli","14,000 - 15,000",Full Time Jobs,Sales - Manufacturing,"03 May 2025, 12:45 PM"
SALES EXECUTIVE,VK AGENCIES,"Trivandrum - Sasthamangalam, Vazhuthacaud","16,000 - 24,000",Full Time Jobs,"Sales - FMCG, Food-and-Beverage-Sales","03 May 2025, 12:45 PM"
Field Sales,Not mentioned,"Bhopal - Idgah Hills, Lalghati, Habib Ganj, TT Nagar + 1 more","13,000 - 15,000",Full Time Jobs,Sales,"03 May 2025, 11:56 AM"
Sales Executive or Internship,Thrive Digital Pro,"Mumbai - Borivali, Malad, Andheri West, Mira Road + 1 more","7,000 - 8,000",Work From Home,Sales,"03 May 2025, 10:58 AM"
Back Office Sales Executive-Pharmaceutical products,ShubhchintaQ HR ServiceS,Lucknow - Alambagh,"15,000 - 25,000",Full Time Jobs,Sales - Pharma,"03 May 2025, 10:38 AM"
Back Office Sales Executive-Pharma MBA Fresher,ShubhchintaQ HR ServiceS,Lucknow - Alambagh,"15,000 - 25,000",Full Time Jobs,Sales - Pharma,"03 May 2025, 10:38 AM"
Salesman for Plywood and Hardware shop,Not mentioned,"Varanasi - Samne Ghat, Nagwa, Lanka, Ramnagar + 1 more","7,000 - 8,000",Full Time Jobs,Sales,"03 May 2025, 09:51 AM"
Sales Executive for Leading Fitness Center,Dopamine feel good gym,Faridabad - Sector 87,"18,000 - 22,000",Full Time Jobs,Sales - Health,"03 May 2025, 09:24 AM"
Sales Executive for Leading Fitness Center,Dopamine Feel Good Gym,Faridabad - Sector 87,"18,000 - 22,000",Full Time Jobs,"Sales - Health, B2B-sales","03 May 2025, 09:24 AM"
Customer Sales Associate,INDIAN TERRAIN FASHION LIMITED,"Chennai - OMR, Thoraipakkam","16,000 - 17,000",Full Time Jobs,"Sales - Others, Industrial-Sales","03 May 2025, 09:04 AM"
FIELD SALES EXECUTIVE,AVL Projects,Vijayawada - Auto Nagar,"18,500 - 21,000",Full Time Jobs,Sales - B2B-sales,"03 May 2025, 08:10 AM"
Jobs For Insurance Agent for commission based,Sankar,Vijayawada - 1 Town,"1,000 - 10,000",Work From Home,"Sales - Health, Real-estate, IT, Banking-&-Financial-Services + 28 more","03 May 2025, 08:10 AM"
Sales Agents Needed,Q7 Corp,"Delhi - South Delhi, West Delhi, Delhi University","10,000 - 30,000",Work From Home,Sales - B2B-sales,"03 May 2025, 03:02 AM"
NEED Sales Associate,Futurecaps,"Kochi - Ernakulam, Kadavanthara","20,000 - 30,000",Work From Home,Sales - Mutual-Funds-Sales,"03 May 2025, 01:13 AM"
Real estate sales - Work from Home,Not mentioned,"Hyderabad - A.N Colony, AG Colony, ALEAP Industrial Area, ALIND Employees Colony + 1 more","18,000 - 40,000",Full Time Jobs,Sales,"02 May 2025, 11:03 PM"
Area Sales Manager,Not mentioned,"Chennai - T Nagar, Kodambakkam, Adyar, Anna Nagar + 1 more","30,000 - 60,000",Full Time Jobs,Sales,"02 May 2025, 06:16 PM"
Tele caller,Aashirwad industries,Nagpur - Hingna Road,"8,000 - 15,000",Full Time Jobs,"Sales - Manufacturing, Telecom","02 May 2025, 05:42 PM"
We are hiring sales executive.,Not mentioned,Bijapur - APMC,"50,000 - 70,000",Full Time Jobs,Sales,"02 May 2025, 04:58 PM"
Senior Sales Manager,Havendaxa Pvt Ltd,Chandigarh - Zirakpur,"50,000 - 80,000",Full Time Jobs,Sales,"02 May 2025, 04:38 PM"
Sales executive manager,Not mentioned,"Lucknow - Lucknow City, Lucknow Airport, Gomti Nagar, Indira Nagar + 1 more","25,000 - 30,000",Full Time Jobs,Sales,"02 May 2025, 03:45 PM"
Relationship Manager,Not mentioned,Hosur - Bagalur-Hosur,"25,000 - 26,000",Full Time Jobs,Sales,"02 May 2025, 03:05 PM"
Sales girl cum acc,Not mentioned,Tirupur - Sirupooluvapatti,"10,000 - 11,000",Full Time Jobs,Sales,"02 May 2025, 03:00 PM"
HDB Financial Services are looking for Sales loan officers,HDB FINANCIAL SERVICES,"Jodhpur - Chandana Bhakar, Gujarawas, K K Colony, Lal Singh Colony + 1 more","15,000 - 17,000",Full Time Jobs,Sales,"02 May 2025, 02:57 PM"
Two Wheeler Sales Executive,Vayalat Motors Pvt Ltd,"Kochi - Ernakulam, Vyttila, Mulamthuruthy, Chottanikkara + 1 more","14,000 - 18,000",Full Time Jobs,Sales - Automobile,"02 May 2025, 02:53 PM"
Telecaller Candidate,Baldota Motors / Panvel Industrial Fastners Pvt Lt,"Navimumbai - Sector 18, Panvel, Sector 18 Kamothe, Sector 17 Vashi + 2 more","10,000 - 18,000",Full Time Jobs,"Sales - Insurance, Retail, Automobile, Telecom","02 May 2025, 02:21 PM"
F&B Manager,Hotel The Royal Vista,Varanasi - Sigra,"11,000 - 18,000",Full Time Jobs,Sales - Food-and-Beverage-Sales,"02 May 2025, 01:27 PM"
SALES EXECUTIVE || IMMEDIATE HIRING || SALARY UPTO 50000,WINSPARK INNOVATIONS LEARNING PRIVATE LIMITED,"Thane - Betwade Gaon, Dharamveer Nagar, Glaxo Smith Kline Limited, Kasarvadavali + 1 more","28,000 - 50,000",Full Time Jobs,Sales,"02 May 2025, 12:45 PM"
Relationship officer,Not mentioned,"Kumbakonam - Thiruvalanjuli, Cholapuram, Karuppur, Neerathanallur + 1 more","15,000 - 25,000",Full Time Jobs,Sales,"02 May 2025, 12:41 PM"
Sales executive,Not mentioned,Nagpur - 8 Mile,"15,000 - 16,000",Full Time Jobs,Sales,"02 May 2025, 12:40 PM"
Field sales officer,HDB FINANCIAL SERVICES,Muzaffarpur - Full City,"15,000 - 17,000",Full Time Jobs,Sales,"02 May 2025, 12:38 PM"
Business Development Executive,Digisculpt Technologies Pvt Ltd,Vadodara - Vadsar,"20,000 - 21,000",Full Time Jobs,"Sales - IT, B2B-sales","02 May 2025, 11:42 AM"
Sales Executive - Showroom,Diya Enterprises,Coimbatore - Saibaba Colony,"15,000 - 18,000",Full Time Jobs,"Sales - Others, Retail","02 May 2025, 11:11 AM"
Job Opportunity - Work From Home | Software Code Promotion,Levatus Wellness Pvt Ltd,"Durgapur - Benachity, Bidhannagar, City Center, Fuljhore + 1 more","5,000 - 25,000",Full Time Jobs,Sales,"02 May 2025, 10:49 AM"
Wanted Sales person for Electrical and plumbing shop,Not mentioned,"Madurai - Bethaniyapuram, Arapalayam","10,000 - 11,000",Full Time Jobs,Sales,"02 May 2025, 10:47 AM"
Marketing and Sales Executive for Real Estate Company,Hausline Realtors Pvt Ltd,"Noida - Sector 62, Sector 63","20,000 - 25,000",Full Time Jobs,Sales - Real-estate,"02 May 2025, 10:36 AM"
Business Development Associate,Wayspire Ed-Tech Private Limited,Gurgaon - South City 1,"15,000 - 18,000",Full Time Jobs,Sales,"02 May 2025, 10:35 AM"
